{
  "id": "00000000-0000-0000-0000-000000000001",
  "version": "1.0.0",
  "campaign_id": "00000000-0000-0000-0000-000000000010",
  "direction": "inbound",
  "voice_profile": "linh_clone_v1",
  "entry_step": "greeting",
  "steps": [
    {
      "id": "greeting",
      "type": "speak_listen",
      "variants": [
        {
          "id": "v1",
          "beats": [
            {"text": "Xin chào,", "pause_after": "breath"},
            {"text": "tôi là Linh từ phòng khám DoctorCheck.", "pause_after": "medium"},
            {"text": "Hôm nay tôi có thể hỗ trợ gì cho bạn ạ?", "pause_after": "turn"}
          ]
        }
      ],
      "reprompt_variants": [
        {
          "id": "r1",
          "beats": [
            {"text": "Bạn có muốn đặt lịch khám không ạ?", "pause_after": "turn"}
          ]
        },
        {
          "id": "r2",
          "beats": [
            {"text": "Tôi vẫn đang nghe ạ.", "pause_after": "breath"},
            {"text": "Bạn cần hỗ trợ gì không?", "pause_after": "turn"}
          ]
        },
        {
          "id": "r3",
          "beats": [
            {"text": "Nếu bạn cần hỗ trợ,", "pause_after": "short"},
            {"text": "tôi có thể kết nối tới nhân viên trực tiếp cho bạn ạ.", "pause_after": "turn"}
          ]
        }
      ],
      "transitions": [
        {"when": "intent == 'book_appointment'", "goto": "collect_date"},
        {"when": "intent == 'check_result'", "goto": "check_result"},
        {"when": "intent == 'cancel_appointment'", "goto": "handle_cancel"},
        {"when": "intent == 'speak_to_staff'", "goto": "handoff_to_staff"}
      ],
      "fallback_goto": "handoff_to_staff",
      "max_no_match": 3
    },
    {
      "id": "collect_date",
      "type": "speak_listen",
      "variants": [
        {
          "id": "v1",
          "beats": [
            {"text": "Bạn muốn đặt lịch khám vào ngày nào ạ?", "pause_after": "turn"}
          ]
        }
      ],
      "reprompt_variants": [
        {
          "id": "r1",
          "beats": [{"text": "Bạn cho tôi biết ngày khám mong muốn nhé ạ.", "pause_after": "turn"}]
        },
        {
          "id": "r2",
          "beats": [{"text": "Ví dụ bạn có thể nói:", "pause_after": "short"}, {"text": "ngày mười lăm tháng này.", "pause_after": "turn"}]
        },
        {
          "id": "r3",
          "beats": [{"text": "Để tiện hơn,", "pause_after": "short"}, {"text": "tôi chuyển bạn tới nhân viên hỗ trợ trực tiếp nhé ạ.", "pause_after": "turn"}]
        }
      ],
      "transitions": [
        {"when": "slot.date != null", "goto": "collect_time"}
      ],
      "fallback_goto": "handoff_to_staff",
      "max_no_match": 3
    },
    {
      "id": "collect_time",
      "type": "speak_listen",
      "variants": [
        {
          "id": "v1",
          "beats": [
            {"text": "Bạn muốn khám vào buổi sáng hay buổi chiều ạ?", "pause_after": "turn"}
          ]
        }
      ],
      "reprompt_variants": [
        {
          "id": "r1",
          "beats": [{"text": "Buổi sáng từ tám đến mười hai giờ,", "pause_after": "short"}, {"text": "hoặc buổi chiều từ mười ba đến mười bảy giờ ạ.", "pause_after": "turn"}]
        },
        {
          "id": "r2",
          "beats": [{"text": "Bạn có thể nói buổi sáng hoặc buổi chiều ạ.", "pause_after": "turn"}]
        },
        {
          "id": "r3",
          "beats": [{"text": "Tôi chuyển sang nhân viên hỗ trợ để đặt lịch cho bạn ạ.", "pause_after": "turn"}]
        }
      ],
      "transitions": [
        {"when": "slot.time_of_day != null", "goto": "confirm_booking"}
      ],
      "fallback_goto": "handoff_to_staff",
      "max_no_match": 3
    },
    {
      "id": "confirm_booking",
      "type": "speak_listen",
      "variants": [
        {
          "id": "v1",
          "beats": [
            {"text": "Tôi xác nhận lịch khám vào", "pause_after": "micro"},
            {"text": "{{date}},", "pause_after": "short"},
            {"text": "buổi {{time_of_day}}.", "pause_after": "medium"},
            {"text": "Bạn xác nhận không ạ?", "pause_after": "turn"}
          ]
        }
      ],
      "reprompt_variants": [
        {
          "id": "r1",
          "beats": [{"text": "Bạn xác nhận đặt lịch không ạ?", "pause_after": "turn"}]
        },
        {
          "id": "r2",
          "beats": [{"text": "Vui lòng nói có hoặc không ạ.", "pause_after": "turn"}]
        },
        {
          "id": "r3",
          "beats": [{"text": "Tôi chuyển bạn sang nhân viên xác nhận trực tiếp nhé ạ.", "pause_after": "turn"}]
        }
      ],
      "transitions": [
        {"when": "intent == 'confirm'", "goto": "booking_success"},
        {"when": "intent == 'deny'", "goto": "booking_cancelled"}
      ],
      "fallback_goto": "handoff_to_staff",
      "max_no_match": 3
    },
    {
      "id": "booking_success",
      "type": "speak",
      "variants": [
        {
          "id": "v1",
          "beats": [
            {"text": "Tuyệt vời ạ.", "pause_after": "medium"},
            {"text": "Lịch khám của bạn đã được đặt thành công.", "pause_after": "medium"},
            {"text": "Phòng khám sẽ nhắn tin xác nhận qua số điện thoại của bạn.", "pause_after": "long"},
            {"text": "Cảm ơn bạn đã gọi tới DoctorCheck.", "pause_after": "medium"},
            {"text": "Chúc bạn sức khỏe ạ.", "pause_after": "long"}
          ]
        }
      ]
    },
    {
      "id": "booking_cancelled",
      "type": "speak",
      "variants": [
        {
          "id": "v1",
          "beats": [
            {"text": "Vậy tôi hủy lịch đặt cho bạn ạ.", "pause_after": "medium"},
            {"text": "Nếu bạn cần hỗ trợ thêm,", "pause_after": "short"},
            {"text": "vui lòng gọi lại cho chúng tôi nhé.", "pause_after": "long"}
          ]
        }
      ]
    },
    {
      "id": "check_result",
      "type": "handoff",
      "variants": [
        {
          "id": "v1",
          "beats": [
            {"text": "Để tra cứu kết quả xét nghiệm,", "pause_after": "short"},
            {"text": "tôi chuyển bạn sang nhân viên chuyên trách ạ.", "pause_after": "turn"}
          ]
        }
      ]
    },
    {
      "id": "handle_cancel",
      "type": "handoff",
      "variants": [
        {
          "id": "v1",
          "beats": [
            {"text": "Để hủy lịch hẹn,", "pause_after": "short"},
            {"text": "tôi cần kết nối bạn với nhân viên để xác nhận thông tin.", "pause_after": "turn"}
          ]
        }
      ]
    },
    {
      "id": "handoff_to_staff",
      "type": "handoff",
      "variants": [
        {
          "id": "v1",
          "beats": [
            {"text": "Tôi sẽ chuyển bạn sang nhân viên hỗ trợ trực tiếp ạ.", "pause_after": "medium"},
            {"text": "Vui lòng chờ giây lát.", "pause_after": "turn"}
          ]
        }
      ]
    }
  ],
  "intents": [
    {
      "intent": "book_appointment",
      "examples": [
        {"text": "tôi muốn đặt lịch khám"},
        {"text": "đặt hẹn khám bệnh"},
        {"text": "cho tôi đặt lịch"},
        {"text": "tôi cần khám bác sĩ"},
        {"text": "đăng ký khám"},
        {"text": "book lịch khám"}
      ],
      "slots": ["date", "time_of_day", "specialty"]
    },
    {
      "intent": "check_result",
      "examples": [
        {"text": "tôi muốn xem kết quả xét nghiệm"},
        {"text": "kết quả xét nghiệm của tôi"},
        {"text": "tra cứu kết quả"},
        {"text": "xem kết quả khám bệnh"}
      ]
    },
    {
      "intent": "cancel_appointment",
      "examples": [
        {"text": "tôi muốn hủy lịch"},
        {"text": "hủy hẹn khám"},
        {"text": "đổi lịch khám"}
      ]
    },
    {
      "intent": "speak_to_staff",
      "examples": [
        {"text": "cho tôi nói chuyện với nhân viên"},
        {"text": "kết nối tới tổng đài viên"},
        {"text": "tôi muốn nói chuyện với người thật"},
        {"text": "chuyển máy cho tôi"}
      ]
    },
    {
      "intent": "confirm",
      "examples": [
        {"text": "có"},
        {"text": "đúng rồi"},
        {"text": "xác nhận"},
        {"text": "ok"},
        {"text": "được"}
      ]
    },
    {
      "intent": "deny",
      "examples": [
        {"text": "không"},
        {"text": "không cần"},
        {"text": "thôi"},
        {"text": "hủy"},
        {"text": "cancel"}
      ]
    }
  ]
}
